{
  "snapshot_id": "DMP-20260322-180000",
  "snapshot_dt": "2026-03-22T18:00:00+09:00",
  "available_at": "2026-03-22T18:05:23+09:00",
  "artifact_version": "v1.0",
  "tickers": ["005930", "000660", "005380"],
  "market_data": {
    "005930": {
      "ohlcv": {"open": 184600, "high": 189000, "low": 183600, "close": 188700},
      "volume": 19747901,
      "mktcap": 1126000000000000,
      "tech_features": {
        "sma_5": 186200,
        "sma_20": 181500,
        "sma_60": 178300,
        "rsi_14": 55.2,
        "bb_upper": 192000,
        "bb_lower": 171000,
        "macd": 1250,
        "macd_signal": 980,
        "atr_14": 4500,
        "volume_ratio_20": 1.15
      }
    },
    "000660": {
      "ohlcv": {"open": 215000, "high": 218500, "low": 213000, "close": 217000},
      "volume": 5234120,
      "mktcap": 158000000000000,
      "tech_features": {
        "sma_5": 214000,
        "sma_20": 210000,
        "sma_60": 205000,
        "rsi_14": 62.1,
        "bb_upper": 225000,
        "bb_lower": 195000,
        "macd": 2100,
        "macd_signal": 1800,
        "atr_14": 5200,
        "volume_ratio_20": 0.95
      }
    },
    "005380": {
      "ohlcv": {"open": 255000, "high": 258000, "low": 252000, "close": 256500},
      "volume": 1823450,
      "mktcap": 54000000000000,
      "tech_features": {
        "sma_5": 254000,
        "sma_20": 248000,
        "sma_60": 242000,
        "rsi_14": 48.7,
        "bb_upper": 265000,
        "bb_lower": 231000,
        "macd": -350,
        "macd_signal": 120,
        "atr_14": 6100,
        "volume_ratio_20": 0.82
      }
    }
  },
  "macro_snapshot": {
    "base_rate": 2.5,
    "treasury_3y": 2.82,
    "treasury_10y": 3.15,
    "usd_krw": 1385.5,
    "kospi_index": 2650.32,
    "vix_proxy": 17.8,
    "market_breadth": 0.53
  },
  "news_index": [
    {
      "evidence_id": "NEWS-20260322-001",
      "ticker": "005930",
      "headline": "삼성전자, HBM4 양산 본격화…SK하이닉스와 격차 좁힌다",
      "source": "naver_news",
      "published_at": "2026-03-22T09:30:00+09:00",
      "available_at": "2026-03-22T17:45:00+09:00",
      "url": "https://n.news.naver.com/article/001/0012345678"
    },
    {
      "evidence_id": "NEWS-20260322-002",
      "ticker": "005380",
      "headline": "현대차, 美 관세 리스크에도 EV 판매 호조",
      "source": "naver_news",
      "published_at": "2026-03-22T11:15:00+09:00",
      "available_at": "2026-03-22T17:45:00+09:00",
      "url": "https://n.news.naver.com/article/015/0012345679"
    }
  ],
  "disclosure_index": [
    {
      "evidence_id": "20260322000123",
      "ticker": "000660",
      "corp_name": "SK하이닉스",
      "report_nm": "주요사항보고서(자기주식취득결정)",
      "rcept_dt": "20260322",
      "rcept_no": "20260322000123",
      "available_at": "2026-03-22T16:30:00+09:00"
    }
  ],
  "meta": {
    "as_of_dt": "2026-03-22T18:00:00+09:00",
    "universe_version": "v1",
    "data_quality": {
      "missing_tickers": [],
      "stale_data_tickers": []
    }
  }
}
